OpenROAD b16bda7e82721d10566ff7e2b68f1ff0be9f9e38 
Features included (+) or not (-): +Charts +GPU +GUI +Python
This program is licensed under the BSD-3 license. See the LICENSE file for details.
Components of this program may be licensed under more restrictive licenses which must be honored.
define_corners Typical
read_liberty -corner Typical /home/sarang/.volare/sky130A/libs.ref/sky130_fd_sc_hd/lib/sky130_fd_sc_hd__tt_025C_1v80.lib
Using 1e-12 for capacitance...
Using 1e+03 for resistance...
Using 1e-09 for time...
Using 1e+00 for voltage...
Using 1e-03 for current...
Using 1e-09 for power...
Using 1e-06 for distance...
[INFO]: Reading ODB at '/openlane/designs/async_fifo/runs/RUN_2025.08.29_07.26.35/tmp/20-async_fifo.odb'…
Reading design constraints file at '/openlane/designs/async_fifo/src/async_fifo.sdc'…
[INFO]: Setting signal min routing layer to: met1 and clock min routing layer to met3. 
[INFO]: Setting signal max routing layer to: met5 and clock max routing layer to met5. 
-congestion_iterations 50 -verbose -congestion_report_file /openlane/designs/async_fifo/runs/RUN_2025.08.29_07.26.35/tmp/routing/groute-congestion.rpt
[INFO GRT-0020] Min routing layer: met1
[INFO GRT-0021] Max routing layer: met5
[INFO GRT-0022] Global adjustment: 30%
[INFO GRT-0023] Grid origin: (0, 0)
[INFO GRT-0043] No OR_DEFAULT vias defined.
[INFO GRT-0088] Layer li1     Track-Pitch = 0.4600  line-2-Via Pitch: 0.3400
[INFO GRT-0088] Layer met1    Track-Pitch = 0.3400  line-2-Via Pitch: 0.3400
[INFO GRT-0088] Layer met2    Track-Pitch = 0.4600  line-2-Via Pitch: 0.3500
[INFO GRT-0088] Layer met3    Track-Pitch = 0.6800  line-2-Via Pitch: 0.6150
[INFO GRT-0088] Layer met4    Track-Pitch = 0.9200  line-2-Via Pitch: 1.0400
[INFO GRT-0088] Layer met5    Track-Pitch = 3.4000  line-2-Via Pitch: 3.1100
[INFO GRT-0019] Found 22 clock nets.
[INFO GRT-0001] Minimum degree: 2
[INFO GRT-0002] Maximum degree: 17
[INFO GRT-0003] Macros: 0
[INFO GRT-0043] No OR_DEFAULT vias defined.
[INFO GRT-0004] Blockages: 2441

[INFO GRT-0053] Routing resources analysis:
          Routing      Original      Derated      Resource
Layer     Direction    Resources     Resources    Reduction (%)
---------------------------------------------------------------
li1        Vertical            0             0          0.00%
met1       Horizontal       8700          4145          52.36%
met2       Vertical         6399          4008          37.37%
met3       Horizontal       4350          2828          34.99%
met4       Vertical         2589          1165          55.00%
met5       Horizontal        858           361          57.93%
---------------------------------------------------------------

[INFO GRT-0197] Via related to pin nodes: 4013
[INFO GRT-0198] Via related Steiner nodes: 97
[INFO GRT-0199] Via filling finished.
[INFO GRT-0111] Final number of vias: 5035
[INFO GRT-0112] Final usage 3D: 17833

[INFO GRT-0096] Final congestion report:
Layer         Resource        Demand        Usage (%)    Max H / Max V / Total Overflow
---------------------------------------------------------------------------------------
li1                  0             0            0.00%             0 /  0 /  0
met1              4145          1189           28.69%             0 /  0 /  0
met2              4008          1393           34.76%             0 /  0 /  0
met3              2828            58            2.05%             0 /  0 /  0
met4              1165            88            7.55%             0 /  0 /  0
met5               361             0            0.00%             0 /  0 /  0
---------------------------------------------------------------------------------------
Total            12507          2728           21.81%             0 /  0 /  0

[INFO GRT-0018] Total wirelength: 30518 um
[INFO GRT-0014] Routed nets: 786
[INFO GRT-0006] Repairing antennas, iteration 1.
[INFO GRT-0043] No OR_DEFAULT vias defined.
[INFO GRT-0012] Found 1 antenna violations.
[INFO GRT-0015] Inserted 1 diodes.
[INFO GRT-0009] rerouting 429 nets.
[INFO GRT-0001] Minimum degree: 2
[INFO GRT-0002] Maximum degree: 17
[INFO GRT-0006] Repairing antennas, iteration 2.
[INFO GRT-0043] No OR_DEFAULT vias defined.
[INFO GRT-0012] Found 0 antenna violations.
Placement Analysis
---------------------------------
total displacement          0.0 u
average displacement        0.0 u
max displacement            0.0 u
original HPWL           15761.7 u
legalized HPWL          15760.5 u
delta HPWL                    0 %

[INFO DPL-0020] Mirrored 243 instances
[INFO DPL-0021] HPWL before           15760.5 u
[INFO DPL-0022] HPWL after            15282.1 u
[INFO DPL-0023] HPWL delta               -3.0 %
[INFO]: Setting signal min routing layer to: met1 and clock min routing layer to met3. 
[INFO]: Setting signal max routing layer to: met5 and clock max routing layer to met5. 
-congestion_iterations 50 -verbose -congestion_report_file /openlane/designs/async_fifo/runs/RUN_2025.08.29_07.26.35/tmp/routing/groute-congestion.rpt
[INFO GRT-0020] Min routing layer: met1
[INFO GRT-0021] Max routing layer: met5
[INFO GRT-0022] Global adjustment: 30%
[INFO GRT-0023] Grid origin: (0, 0)
[INFO GRT-0043] No OR_DEFAULT vias defined.
[INFO GRT-0088] Layer li1     Track-Pitch = 0.4600  line-2-Via Pitch: 0.3400
[INFO GRT-0088] Layer met1    Track-Pitch = 0.3400  line-2-Via Pitch: 0.3400
[INFO GRT-0088] Layer met2    Track-Pitch = 0.4600  line-2-Via Pitch: 0.3500
[INFO GRT-0088] Layer met3    Track-Pitch = 0.6800  line-2-Via Pitch: 0.6150
[INFO GRT-0088] Layer met4    Track-Pitch = 0.9200  line-2-Via Pitch: 1.0400
[INFO GRT-0088] Layer met5    Track-Pitch = 3.4000  line-2-Via Pitch: 3.1100
[INFO GRT-0019] Found 22 clock nets.
[INFO GRT-0001] Minimum degree: 2
[INFO GRT-0002] Maximum degree: 17
[INFO GRT-0003] Macros: 0
[INFO GRT-0043] No OR_DEFAULT vias defined.
[INFO GRT-0004] Blockages: 2441

[INFO GRT-0053] Routing resources analysis:
          Routing      Original      Derated      Resource
Layer     Direction    Resources     Resources    Reduction (%)
---------------------------------------------------------------
li1        Vertical            0             0          0.00%
met1       Horizontal       8700          4147          52.33%
met2       Vertical         6399          4008          37.37%
met3       Horizontal       4350          2828          34.99%
met4       Vertical         2589          1165          55.00%
met5       Horizontal        858           361          57.93%
---------------------------------------------------------------

[INFO GRT-0197] Via related to pin nodes: 4008
[INFO GRT-0198] Via related Steiner nodes: 97
[INFO GRT-0199] Via filling finished.
[INFO GRT-0111] Final number of vias: 5029
[INFO GRT-0112] Final usage 3D: 17814

[INFO GRT-0096] Final congestion report:
Layer         Resource        Demand        Usage (%)    Max H / Max V / Total Overflow
---------------------------------------------------------------------------------------
li1                  0             0            0.00%             0 /  0 /  0
met1              4147          1187           28.62%             0 /  0 /  0
met2              4008          1394           34.78%             0 /  0 /  0
met3              2828            58            2.05%             0 /  0 /  0
met4              1165            88            7.55%             0 /  0 /  0
met5               361             0            0.00%             0 /  0 /  0
---------------------------------------------------------------------------------------
Total            12509          2727           21.80%             0 /  0 /  0

[INFO GRT-0018] Total wirelength: 30498 um
[INFO GRT-0014] Routed nets: 786
Setting global connections for newly added cells…
Writing OpenROAD database to '/openlane/designs/async_fifo/runs/RUN_2025.08.29_07.26.35/tmp/routing/22-global.odb'…
Writing layout to '/openlane/designs/async_fifo/runs/RUN_2025.08.29_07.26.35/tmp/routing/22-global.def'…
Writing routing guides to '/openlane/designs/async_fifo/runs/RUN_2025.08.29_07.26.35/tmp/routing/22-global.guide'…
